{
  "deviceName": "Desk tower",

  "self": { "machine": "tower", "system": "windows" },

  "localAgent": {
    "argv": ["C:\\Program Files\\nodejs\\node.exe", "C:\\Users\\me\\.legion-control\\bin\\launcher.mjs"]
  },

  "currentSite": "flat",

  "identityFile": "~/.ssh/legion-control_ed25519",

  "machines": {
    "attic-box": { "identityFile": "~/.ssh/id_attic", "sshAlias": "attic-box-lan" },
    "router-flat": { "identityFile": "~/.ssh/id_router" }
  }
}
